{
  "$schema": "https://json-schema.org/draft/2020-12/schema",
  "$id": "https://reviewsensei.dev/schemas/decision-response.schema.json",
  "title": "Closed-choice decision response (not action authority)",
  "type": "object",
  "additionalProperties": false,
  "required": ["schema_version", "request_sha256", "provider", "model", "completion", "answers", "usage"],
  "properties": {
    "schema_version": {"const": "1.0"},
    "request_sha256": {"type": "string", "pattern": "^[a-f0-9]{64}$"},
    "provider": {"type": "string", "minLength": 1, "maxLength": 128},
    "model": {"type": "string", "minLength": 1, "maxLength": 128},
    "completion": {"const": "complete"},
    "answers": {
      "type": "object", "minProperties": 1, "maxProperties": 16,
      "propertyNames": {"pattern": "^[a-z][a-z0-9_]{0,63}$"},
      "additionalProperties": {"type": "string", "minLength": 1, "maxLength": 64}
    },
    "usage": {
      "type": "object", "additionalProperties": false,
      "required": ["input_tokens", "output_tokens"],
      "properties": {
        "input_tokens": {"type": ["integer", "null"], "minimum": 0, "maximum": 9007199254740991},
        "output_tokens": {"type": ["integer", "null"], "minimum": 0, "maximum": 9007199254740991}
      }
    }
  }
}
